{
  "schemaVersion": 1,
  "languageId": "javascript",
  "title": "JavaScript 객관식 복습",
  "questions": [
    {
      "id": "quiz-javascript-notes-return-value",
      "lessonId": "js-notes-functions",
      "conceptId": "js.function-return",
      "learningObjective": "콘솔에 표시한 값과 함수 호출자가 받은 반환값을 구분합니다.",
      "difficulty": "basic",
      "prompt": "console.log를 사용할 수 있는 환경에서 다음 코드를 실행했습니다. 콘솔에 표시되는 두 값의 순서는 무엇입니까?",
      "code": "function showDouble(value) {\n  console.log(value * 2);\n}\n\nconst result = showDouble(3);\nconsole.log(result);",
      "options": [
        {
          "id": "a",
          "text": "6, 6",
          "isCorrect": false,
          "feedback": "함수 안에서 6을 콘솔에 표시해도 호출자에게 6을 반환한 것은 아닙니다. 이 함수에는 return이 없습니다."
        },
        {
          "id": "b",
          "text": "6, undefined",
          "isCorrect": true,
          "feedback": "먼저 함수 안에서 6을 표시합니다. 반환문 없이 함수가 끝나므로 result는 undefined입니다. 교안의 ‘return과 출력은 다르다’를 다시 확인하세요."
        },
        {
          "id": "c",
          "text": "undefined, 6",
          "isCorrect": false,
          "feedback": "showDouble(3)이 먼저 실행되어 6을 표시한 뒤 result에 반환값이 대입됩니다. 바깥 출력이 먼저 실행되지 않습니다."
        },
        {
          "id": "d",
          "text": "아무 값도 표시되지 않고 TypeError가 발생합니다.",
          "isCorrect": false,
          "feedback": "반환문 없는 함수도 정상 호출할 수 있습니다. console.log가 제공된다는 조건이 있으므로 6과 undefined가 순서대로 표시됩니다."
        }
      ]
    },
    {
      "id": "quiz-javascript-notes-early-return",
      "lessonId": "js-notes-functions",
      "conceptId": "js.function-return",
      "learningObjective": "조기 반환으로 실행되지 않는 콜백과 부수 효과를 찾아냅니다.",
      "difficulty": "application",
      "prompt": "음수 입력은 거부하고, 허용된 입력만 format으로 보내려 합니다. 코드를 실행한 뒤 message와 calls의 값은 각각 무엇입니까?",
      "code": "let calls = 0;\n\nfunction describe(minutes, format) {\n  if (minutes < 0) {\n    return \"입력 확인\";\n  }\n  return format(minutes);\n}\n\nfunction format(minutes) {\n  calls = calls + 1;\n  return minutes + \"분\";\n}\n\nconst message = describe(-2, format);",
      "options": [
        {
          "id": "a",
          "text": "message는 \"입력 확인\", calls는 1",
          "isCorrect": false,
          "feedback": "조건 안의 return에서 describe 실행이 끝납니다. 뒤의 format 호출은 일어나지 않아 calls도 증가하지 않습니다."
        },
        {
          "id": "b",
          "text": "message는 \"-2분\", calls는 1",
          "isCorrect": false,
          "feedback": "-2는 0보다 작아 입력 거부 분기로 들어갑니다. 뒤의 format까지 실행해 결과를 덮어쓰지 않습니다."
        },
        {
          "id": "c",
          "text": "message는 \"입력 확인\", calls는 0",
          "isCorrect": true,
          "feedback": "조기 반환이 format 호출 전에 describe를 끝냅니다. 따라서 입력 확인을 돌려주고, 호출되지 않은 format의 calls 변경도 없습니다. 교안의 ‘반환값은 호출한 곳으로 돌아간다’를 참고하세요."
        },
        {
          "id": "d",
          "text": "message는 undefined, calls는 0",
          "isCorrect": false,
          "feedback": "이 경로에는 return과 문자열 값이 명시돼 있습니다. 콜백을 호출하지 않는다고 반환값까지 없어지는 것은 아닙니다."
        }
      ]
    },
    {
      "id": "quiz-javascript-notes-sync-callback",
      "lessonId": "js-notes-functions",
      "conceptId": "js.callbacks",
      "learningObjective": "함수 값 전달과 실제 호출을 구분하고 동기 콜백의 반환 연결을 추적합니다.",
      "difficulty": "basic",
      "prompt": "아래 코드에는 타이머나 Promise가 없습니다. result에 대입되는 값과 이유를 올바르게 설명한 것은 무엇입니까?",
      "code": "function applyTwice(value, change) {\n  const once = change(value);\n  return change(once);\n}\n\nfunction double(value) {\n  return value * 2;\n}\n\nconst result = applyTwice(3, double);",
      "options": [
        {
          "id": "a",
          "text": "12 — 현재 호출 안에서 3 → 6 → 12로 두 번 계산합니다.",
          "isCorrect": true,
          "feedback": "double 함수 값이 전달되고 applyTwice가 그 함수를 즉시 두 번 호출합니다. 콜백이 항상 비동기는 아닙니다. 교안의 ‘함수도 값이다’를 참고하세요."
        },
        {
          "id": "b",
          "text": "6 — 같은 함수는 한 번만 실행할 수 있습니다.",
          "isCorrect": false,
          "feedback": "같은 함수를 여러 번 호출할 수 있습니다. 두 번째 change(once)는 첫 반환값 6을 받아 다시 두 배로 만듭니다."
        },
        {
          "id": "c",
          "text": "undefined — 콜백은 항상 나중에 실행되므로 result가 먼저 정해집니다.",
          "isCorrect": false,
          "feedback": "이 코드는 전달받은 함수를 현재 실행 흐름에서 바로 호출합니다. 콜백이라는 이름만으로 비동기 예약이 생기지 않습니다."
        },
        {
          "id": "d",
          "text": "TypeError — 함수는 인수로 전달할 수 없습니다.",
          "isCorrect": false,
          "feedback": "JavaScript 함수는 값이므로 인수로 전달할 수 있습니다. double 뒤에 괄호를 쓰지 않은 것은 지금 호출하지 않고 함수 자체를 전달하려는 것입니다."
        }
      ]
    },
    {
      "id": "quiz-javascript-notes-arrow-block-return",
      "lessonId": "js-notes-functions",
      "conceptId": "js.function-return",
      "learningObjective": "화살표 함수의 표현식 본문과 블록 본문에서 반환 규칙이 달라지는 이유를 찾습니다.",
      "difficulty": "application",
      "prompt": "계산 결과를 변수에 담도록 코드를 바꾼 뒤 after(4)가 undefined가 되었습니다. 원인과 가장 직접적인 수정은 무엇입니까?",
      "code": "const before = value => value * 2;\n\nconst after = value => {\n  const result = value * 2;\n};",
      "options": [
        {
          "id": "a",
          "text": "const는 계산 결과를 막으므로 result를 let으로 바꿉니다.",
          "isCorrect": false,
          "feedback": "const로 계산 결과를 기억할 수 있습니다. let으로 바꿔도 함수 밖으로 반환하는 문장이 없다는 문제는 남습니다."
        },
        {
          "id": "b",
          "text": "화살표 함수는 변수 선언을 포함할 수 없으므로 일반 함수로 바꿉니다.",
          "isCorrect": false,
          "feedback": "블록 본문의 화살표 함수에는 변수 선언을 쓸 수 있습니다. 일반 함수로 바꾸더라도 반환문을 쓰지 않으면 결과는 undefined입니다."
        },
        {
          "id": "c",
          "text": "result라는 이름이 예약어이므로 answer로 바꿉니다.",
          "isCorrect": false,
          "feedback": "result는 이 코드에서 사용할 수 있는 변수 이름입니다. 이름을 바꾸어도 반환문이 생기지는 않습니다."
        },
        {
          "id": "d",
          "text": "블록 본문은 계산식을 자동 반환하지 않으므로 return result;를 추가합니다.",
          "isCorrect": true,
          "feedback": "before는 표현식 값을 바로 반환하지만 after는 블록 본문입니다. result 계산 뒤 return result;를 쓰면 after(4)는 8을 반환합니다. 교안의 ‘화살표 함수’를 참고하세요."
        }
      ]
    },
    {
      "id": "quiz-javascript-notes-function-boundary",
      "lessonId": "js-notes-functions",
      "conceptId": "js.function-side-effects",
      "learningObjective": "입력·반환값·외부 상태 변경을 기준으로 요구사항에 맞는 함수 경계를 선택합니다.",
      "difficulty": "application",
      "prompt": "여러 화면에서 결제 금액을 계산해 각각 표시하려 합니다.\ncalc(100)은 숫자 90을 반환해야 하고, 바깥 변수 total을 바꾸거나 콘솔에 출력하지 않아야 합니다.\n아래 네 함수 중 이 계약을 만족하는 것은 무엇입니까?",
      "code": "let total = 0;\n\nfunction calcA(price) {\n  total = total + price * 0.9;\n  return price * 0.9;\n}\n\nfunction calcB(price) {\n  console.log(price * 0.9);\n}\n\nfunction calcC(price) {\n  return price * 0.9;\n}\n\nfunction calcD(price) {\n  const result = price * 0.9;\n}",
      "options": [
        {
          "id": "a",
          "text": "calcA",
          "isCorrect": false,
          "feedback": "90을 반환하지만 함수 밖의 total도 바꿉니다. 반환값이 맞는 것만으로 외부 상태 보존 계약까지 만족하지는 않습니다."
        },
        {
          "id": "b",
          "text": "calcB",
          "isCorrect": false,
          "feedback": "콘솔 출력은 요구사항에서 제외됐고, 함수에는 반환문도 없습니다. 화면마다 계산 결과를 쓰려면 값을 호출자에게 돌려줘야 합니다."
        },
        {
          "id": "c",
          "text": "calcC",
          "isCorrect": true,
          "feedback": "입력 price로 금액을 계산해 반환하고 total이나 콘솔을 바꾸지 않습니다. 표시할 화면은 호출자가 정할 수 있습니다. 교안의 ‘계산만 하는 함수와 바깥을 바꾸는 함수’를 참고하세요."
        },
        {
          "id": "d",
          "text": "calcD",
          "isCorrect": false,
          "feedback": "함수 안에서 90을 계산하지만 반환하지 않습니다. 지역 변수에 담았다는 사실만으로 호출자가 그 값을 받지는 않습니다."
        }
      ]
    },
    {
      "id": "quiz-javascript-notes-const-property",
      "lessonId": "js-notes-values",
      "conceptId": "js.variables",
      "learningObjective": "const 이름의 재대입과 그 이름이 가리키는 객체의 속성 변경을 구분합니다.",
      "difficulty": "basic",
      "prompt": "다음 코드를 실행했을 때 lamp.on의 값과 이유를 올바르게 설명한 것은 무엇입니까?",
      "code": "const lamp = { on: false };\nlamp.on = true;",
      "options": [
        {
          "id": "a",
          "text": "false — const로 만든 객체의 속성은 바뀌지 않습니다.",
          "isCorrect": false,
          "feedback": "const는 lamp라는 이름의 재대입을 막습니다. 객체 내부 속성까지 자동으로 불변으로 만들지는 않습니다."
        },
        {
          "id": "b",
          "text": "true — 같은 객체의 on 속성을 바꾼 것이며 lamp에 다른 객체를 대입하지 않았습니다.",
          "isCorrect": true,
          "feedback": "lamp는 계속 같은 객체를 가리키고 그 객체의 on만 true가 됩니다. 교안의 ‘값을 기억하는 이름: 변수’를 참고하세요."
        },
        {
          "id": "c",
          "text": "TypeError — const 이름을 선언한 뒤 사용하는 모든 대입은 금지됩니다.",
          "isCorrect": false,
          "feedback": "금지되는 것은 lamp = 다른값 같은 이름의 재대입입니다. 이 코드의 lamp.on = true는 변경 가능한 속성에 대한 대입입니다."
        },
        {
          "id": "d",
          "text": "undefined — 속성에 값을 대입하면 그 속성이 삭제됩니다.",
          "isCorrect": false,
          "feedback": "속성 대입은 값을 바꾸는 동작이지 속성을 삭제하는 동작이 아닙니다. on 속성은 true를 가진 채 남습니다."
        }
      ]
    },
    {
      "id": "quiz-javascript-notes-string-addition",
      "lessonId": "js-notes-values",
      "conceptId": "js.operators",
      "learningObjective": "더하기 연산의 피연산자 타입을 보고 숫자 덧셈과 문자열 연결을 구분합니다.",
      "difficulty": "basic",
      "prompt": "한 번 처리할 때마다 count를 숫자로 1씩 늘리려 했습니다. 아래 실행 뒤 count의 실제 값과 타입은 무엇입니까?",
      "code": "let count = \"2\";\ncount = count + 1;",
      "options": [
        {
          "id": "a",
          "text": "숫자 3",
          "isCorrect": false,
          "feedback": "처음 count는 따옴표로 감싼 문자열입니다. 이 + 연산은 숫자 덧셈이 아니라 글자를 이어 붙입니다."
        },
        {
          "id": "b",
          "text": "문자열 \"3\"",
          "isCorrect": false,
          "feedback": "먼저 2와 1을 수치로 더한 뒤 문자열로 바꾸지 않습니다. 문자열 \"2\" 뒤에 \"1\"을 붙입니다."
        },
        {
          "id": "c",
          "text": "숫자 21",
          "isCorrect": false,
          "feedback": "이 연산은 이어 붙인 문자열을 만듭니다. 숫자처럼 보이는 글자와 Number 타입 값은 다릅니다."
        },
        {
          "id": "d",
          "text": "문자열 \"21\"",
          "isCorrect": true,
          "feedback": "문자열 \"2\"와 1을 +로 연결하면 \"21\"입니다. 이 예에서 숫자 증가를 원하면 초기값을 숫자 2로 두어야 합니다. 교안의 ‘값을 계산하고 비교하는 연산자’를 참고하세요."
        }
      ]
    },
    {
      "id": "quiz-javascript-notes-switch-break",
      "lessonId": "js-notes-values",